[
    {
        "appname":"小米手机助手",
        "appid":"xxxxx",
        "appkey":"yyyy",
        "qps":50,
        "qpd":500000,
        "ctime":1474283539,
        "strategy":"xiaomi",
        "version":"1.0.0",
        "bots":[
            {"id":"talk_service","version":"1.0.0"},
            {"id":"aries_general","version":"1.0.0"},
            {"id":"movie_satisfy","version":"1.0.0"},
            {"id":"light_vertical","version":"1.0.0"},
            {"id":"recommend_service_wireless","version":"1.0.0","params":{"joke_type":1}},
            {"id":"restaurant_bot","version":"1.0.0"}
        ]
    },
    {
        "appname":"小米手机助手",
        "appid":"xxxxx1",
        "appkey":"yyyy1",
        "qps":0,
        "qpd":0,
        "ctime":1474283539,
        "strategy":"xiaomi",
        "version":"1.0.0",
        "bots":[
            {"id":"talk_service","version":"1.0.0"},
            {"id":"aries_general","version":"1.0.0"},
            {"id":"movie_satisfy","version":"1.0.0"},
            {"id":"light_vertical","version":"1.0.0"},
            {"id":"recommend_service_wireless","version":"1.0.0","params":{"joke_type":1}},
            {"id":"restaurant_bot","version":"1.0.0"}
        ]
    }
]
